{
  "schema_version": 7,
  "width": 4800,
  "height": 2400,
  "frame_rate": 12,
  "tools": [
    {
      "kind": "pencil",
      "geometry": "smooth",
      "width": 32,
      "color": "#000000"
    },
    {
      "kind": "eraser",
      "geometry": "smooth",
      "width": 64
    }
  ],
  "layers": [
    {
      "hidden": false,
      "frames": [
        {
          "strokes": [
            {
              "points": [
                0,
                0,
                400,
                200
              ],
              "tool_id": 0
            }
          ]
        },
        {
          "strokes": [
            {
              "points": [
                400,
                200,
                800,
                400
              ],
              "tool_id": 0
            }
          ]
        }
      ]
    },
    {
      "hidden": true,
      "frames": [
        {
          "strokes": [
            {
              "points": [
                100,
                100,
                200,
                100
              ],
              "tool_id": 1
            }
          ]
        },
        {
          "strokes": []
        }
      ]
    },
    {
      "hidden": false,
      "frames": [
        {
          "strokes": []
        },
        {
          "strokes": [
            {
              "points": [
                10,
                20,
                30,
                40,
                50,
                60
              ],
              "tool_id": 0
            }
          ]
        }
      ]
    }
  ]
}
