{
  "schema_version": 7,
  "width": 4800,
  "height": 2400,
  "frame_rate": 12,
  "tools": [],
  "layers": [
    {
      "hidden": false,
      "frames": [
        {
          "strokes": []
        },
        {
          "strokes": []
        },
        {
          "strokes": []
        }
      ]
    },
    {
      "hidden": false,
      "frames": [
        {
          "strokes": []
        },
        {
          "strokes": []
        },
        {
          "strokes": []
        }
      ]
    }
  ],
  "holds": [
    1,
    4,
    99
  ]
}
